<?xml version="1.0" encoding="UTF-8"?>
<metadata
        xmlns:xsi="http://www.w3.org/2001/XMLSchema-instance"
        xsi:noNamespaceSchemaLocation="../../../../../xsd/src/main/resources/metadata.xsd">
    <kpi>
        <name>battery_level</name>
        <friendlyName>Battery level</friendlyName>
        <offeredMetric>
            <name>avg</name>
            <calculation>sum(${kpi})/sum(${table}samples_sum)</calculation>
            <friendlyName>Average</friendlyName>
            <description></description>
        </offeredMetric>
        <column>
            <postfix></postfix>
            <datatype>INT8</datatype>
        </column>
    </kpi>
    <kpi>
        <name>estimated_km</name>
        <friendlyName>Estimated kilometers</friendlyName>
        <offeredMetric>
            <name>sum</name>
            <calculation>sum(${kpi})</calculation>
            <friendlyName>Sum</friendlyName>
            <description></description>
        </offeredMetric>
        <offeredMetric>
            <name>avg</name>
            <calculation>sum(${kpi})/sum(${table}samples_sum)</calculation>
            <friendlyName>Average</friendlyName>
            <description></description>
        </offeredMetric>
        <column>
            <postfix></postfix>
            <datatype>INT32</datatype>
        </column>
    </kpi>
    <kpi>
        <name>samples</name>
        <friendlyName>Number of cars</friendlyName>
        <offeredMetric>
            <name>sum</name>
            <calculation>sum(${kpi}_sum)</calculation>
            <friendlyName>Sum</friendlyName>
            <description></description>
        </offeredMetric>
        <column>
            <postfix>sum</postfix>
            <datatype>INT8</datatype>
        </column>
    </kpi>
    <dimension>
        <name>start_time</name>
        <friendlyName>Timestamp</friendlyName>
        <datatype>INT32</datatype>
    </dimension>
    <dimension>
        <name>timestamp</name>
        <friendlyName>Timestamp</friendlyName>
        <datatype>INT32</datatype>
    </dimension>
    <dimension>
        <name>company</name>
        <friendlyName>Company</friendlyName>
        <datatype>STRING</datatype>
    </dimension>
    <dimension>
        <name>address</name>
        <friendlyName>Address</friendlyName>
        <datatype>STRING</datatype>
    </dimension>
    <dimension>
        <name>battery_state</name>
        <friendlyName>battery_state</friendlyName>
        <datatype>STRING</datatype>
    </dimension>
    <dimension>
        <name>battery_state_desc</name>
        <friendlyName>battery_state_desc</friendlyName>
        <datatype>STRING</datatype>
    </dimension>
    <dimension>
        <name>color</name>
        <friendlyName>color</friendlyName>
        <datatype>STRING</datatype>
    </dimension>
    <dimension>
        <name>color_desc</name>
        <friendlyName>color_desc</friendlyName>
        <datatype>STRING</datatype>
    </dimension>
    <dimension>
        <name>distance</name>
        <friendlyName>distance</friendlyName>
        <datatype>INT8</datatype>
    </dimension>
    <dimension>
        <name>doors</name>
        <friendlyName>doors</friendlyName>
        <datatype>INT8</datatype>
    </dimension>
    <dimension>
        <name>gps_lat</name>
        <friendlyName>gps_lat</friendlyName>
        <datatype>DOUBLE</datatype>
    </dimension>
    <dimension>
        <name>gps_long</name>
        <friendlyName>gps_long</friendlyName>
        <datatype>DOUBLE</datatype>
    </dimension>
    <dimension>
        <name>make</name>
        <friendlyName>make haze</friendlyName>
        <datatype>STRING</datatype>
    </dimension>
    <dimension>
        <name>make_desc</name>
        <friendlyName>make_desc</friendlyName>
        <datatype>STRING</datatype>
    </dimension>
    <dimension>
        <name>max_range</name>
        <friendlyName>max_range</friendlyName>
        <datatype>INT8</datatype>
    </dimension>
    <dimension>
        <name>model</name>
        <friendlyName>model</friendlyName>
        <datatype>STRING</datatype>
    </dimension>
    <dimension>
        <name>plate_number</name>
        <friendlyName>plate_number</friendlyName>
        <datatype>STRING</datatype>
    </dimension>
    <dimension>
        <name>seats</name>
        <friendlyName>seats</friendlyName>
        <datatype>INT8</datatype>
    </dimension>
    <dimension>
        <name>state</name>
        <friendlyName>state</friendlyName>
        <datatype>STRING</datatype>
    </dimension>
    <dimension>
        <name>state_desc</name>
        <friendlyName>state_desc</friendlyName>
        <datatype>STRING</datatype>
    </dimension>
    <dimension>
        <name>variant</name>
        <friendlyName>variant</friendlyName>
        <datatype>STRING</datatype>
    </dimension>
    <dimension>
        <name>vehicle_id</name>
        <friendlyName>vehicle_id</friendlyName>
        <datatype>STRING</datatype>
    </dimension>
    <!--aggregator.statistics-->
    <kpi>
        <name>rownum</name>
        <friendlyName>Number of rows</friendlyName>
        <offeredMetric>
            <name>sum</name>
            <calculation>sum(rownum_sum)</calculation>
            <friendlyName>Sum</friendlyName>
            <description></description>
        </offeredMetric>
        <column>
            <postfix>sum</postfix>
            <datatype>INT32</datatype>
        </column>
    </kpi>
    <dimension>
        <name>schema</name>
        <friendlyName>Schema</friendlyName>
        <datatype>STRING</datatype>
    </dimension>
    <dimension>
        <name>table</name>
        <friendlyName>Table</friendlyName>
        <datatype>STRING</datatype>
    </dimension>
    <dimension>
        <name>start_time</name>
        <friendlyName>Start time</friendlyName>
        <datatype>INT32</datatype>
    </dimension>

</metadata>